{
  "campaign_id": "NO-AKVA-FEED-SPARES-0001",
  "schema_version": "2.0",
  "track": "B2B_RESOLUTION",
  "country": "NO",
  "language": "no",
  "atom": {
    "oem_ecosystem": [
      "AKVA Group"
    ],
    "asset": "aquaculture_feed_system",
    "generation_scope": [
      "CF_feed_system_families"
    ],
    "component_scope": [
      "selector_valve",
      "doser_valve",
      "sensor",
      "VSD",
      "PLC_IO",
      "service_kit"
    ],
    "triggers": [
      "FAILURE",
      "MAINTENANCE",
      "OBSOLESCENCE"
    ]
  },
  "buyer_route": {
    "problem_noticer": "fish_farm_technician",
    "diagnoser": "fish_farm_technician_or_service_engineer",
    "sku_selector": "professional_requisitioner",
    "payer": "aquaculture_operator",
    "installer": "professional_technician"
  },
  "supplier_strategy": {
    "candidate_supplier_ids": [
      "SUP-AKVA"
    ],
    "transaction_route": "RFQ_PO"
  },
  "distribution_strategy": {
    "google_merchant_center": false,
    "shopify_catalog": false,
    "web_jsonld": true,
    "rfq_api": true,
    "service_booking": false
  },
  "evidence_requirements": [
    "BOM_graph",
    "professional_requisition_workflow",
    "supplier_RFQ_acceptance",
    "economic_value_or_downtime_proxy",
    "incumbent_resolution_benchmark"
  ],
  "experiment": {
    "resolver_cases": 100,
    "incumbent_cases": 30,
    "success_rules": [
      ">= configured exact-BOM resolution threshold",
      "supplier accepts structured RFQ/PO handoff"
    ],
    "kill_rules": [
      "AKVA already exposes equivalent public resolver",
      "no executable procurement path"
    ]
  }
}