{
  "campaign_id": "FI-UFH-LEGACY-CONTROLS-0001",
  "schema_version": "2.0",
  "track": "D2C_MIGRATION_BUNDLE",
  "country": "FI",
  "language": "fi",
  "atom": {
    "oem_ecosystem": [
      "Uponor",
      "Wirsbo",
      "Pexep"
    ],
    "asset": "hydronic_underfloor_heating_system",
    "generation_scope": [
      "legacy_manifolds_pre_1986_to_2001",
      "Wirsbo_1990_2006",
      "Uponor_Control_System_2006_2015",
      "Smatrix_2015_2020",
      "Vario_B_1999_2024"
    ],
    "component_scope": [
      "thermostat",
      "actuator",
      "controller",
      "manifold_valve",
      "adapter",
      "replacement_control_system"
    ],
    "triggers": [
      "FAILURE",
      "OBSOLESCENCE",
      "SUCCESSOR_MIGRATION"
    ]
  },
  "buyer_route": {
    "problem_noticer": "consumer",
    "diagnoser": null,
    "sku_selector": null,
    "payer": "consumer",
    "installer": "mixed"
  },
  "supplier_strategy": {
    "candidate_supplier_ids": [
      "SUP-LVIFI",
      "SUP-ONNINEN",
      "SUP-NETRAUTA"
    ],
    "transaction_route": "UNKNOWN"
  },
  "distribution_strategy": {
    "google_merchant_center": true,
    "shopify_catalog": true,
    "web_jsonld": true,
    "rfq_api": false,
    "service_booking": false
  },
  "evidence_requirements": [
    "surviving_installed_base",
    "buyer_role_sample",
    "25_positive_compatibility_edges",
    "5_negative_or_supersession_edges",
    "supplier_reseller_terms",
    "real_supplier_costs",
    "30_case_incumbent_benchmark",
    "addressable_annual_demand"
  ],
  "experiment": {
    "resolver_cases": 50,
    "incumbent_cases": 30,
    "success_rules": [
      "all hard gates pass",
      "our compatibility resolution LCB >= configured rubric threshold"
    ],
    "kill_rules": [
      "professional normally selects exact SKU",
      "best incumbent owns >= hard-fail benchmark threshold",
      "no reseller path"
    ]
  }
}